{
  "schema_version": "0.1.0",
  "claim_id": "fictional-claim-001",
  "subject_local_id": "fictional-subject",
  "statement": "In complex collaborative work, the fictional subject often asks for a written synthesis before making a final decision.",
  "status": "proposed",
  "basis": [
    "self-stated",
    "described-episode"
  ],
  "scope": {
    "contexts": [
      "high-complexity collaborative decisions"
    ],
    "time_horizon": "recurring",
    "limits": "The example does not establish a preference for writing in urgent or low-stakes decisions."
  },
  "confidence": 0.65,
  "evidence_refs": [
    {
      "locator": "vault://fictional/transcripts/session-001#turns=42-49",
      "relation": "supports"
    }
  ],
  "counterevidence_refs": [
    {
      "locator": "vault://fictional/transcripts/session-001#turns=58-61",
      "relation": "challenges"
    }
  ],
  "alternatives": [
    "The request for writing may reflect the complexity of that project rather than a recurring decision pattern."
  ],
  "review": {
    "state": "unreviewed",
    "reviewed_at": null,
    "review_note": ""
  },
  "supersedes": []
}
